Reading List ID,Google Books ID,Apple Books ID,ISBN-13,Title,Subtitle,Authors,Page Count,Publication Date,Publisher,Description,Subjects,Language Code,Started Reading,Paused,Finished Reading,Did Not Finish,Current Page,Current Percentage,Rating,Notes,Lists
16453A5E-2CCF-4A35-AA47-5D1AA82AE752,1yWlEAAAQBAJ,,9781524748814,The Lumumba Plot,The Secret History of the CIA and a Cold War Assassination,"Reid, Stuart A.",624,,Knopf Doubleday Publishing Group,"The New York Times Book Review Editors' Choice • A spellbinding work of history that reads like a Cold War spy thriller—about the U.S.-sanctioned plot to assassinate the democratically elected leader of the newly independent Congo

A BEST BOOK OF THE YEAR: The New Yorker, The Economist, Financial Times

“This is one of the best books I have read in years . . . gripping, full of colorful characters, and strange plot twists.” —Fareed Zakaria, CNN host

It was supposed to be a moment of great optimism, a cause for jubilation. The Congo was at last being set free from Belgium—one of seventeen countries to gain independence in 1960 from ruling European powers. At the helm as prime minister was charismatic nationalist Patrice Lumumba. Just days after the handover, however, the Congo’s new army mutinied, Belgian forces intervened, and Lumumba turned to the United Nations for help in saving his newborn nation from what the press was already calling “the Congo crisis.” Dag Hammarskjöld, the tidy Swede serving as UN secretary-general, quickly arranged the organization’s biggest peacekeeping mission in history. But chaos was still spreading. Frustrated with the fecklessness of the UN and spurned by the United States, Lumumba then approached the Soviets for help—an appeal that set off alarm bells at the CIA. To forestall the spread of Communism in Africa, the CIA sent word to its station chief in the Congo, Larry Devlin: Lumumba had to go.

Within a year, everything would unravel. The CIA plot to murder Lumumba would ﬁzzle out, but he would be deposed in a CIA-backed coup, transferred to enemy territory in a CIA-approved operation, and shot dead by Congolese assassins. Hammarskjöld, too, would die, in a mysterious plane crash en route to negotiate a cease-ﬁre with the Congo’s rebellious southeast. And a young, ambitious military officer named Joseph Mobutu, who had once sworn fealty to Lumumba, would seize power with U.S. help and misrule the country for more than three decades. For the Congolese people, the events of 1960–61 represented the opening chapter of a long horror story. For the U.S. government, however, they provided a playbook for future interventions.",Africa; African; Central; History; Political Science; World,en,2024-02-09,,2024-02-18,,,,,,
31F1FFFD-23AD-4958-9EC8-A7ADF4DBC172,PBswGwAACAAJ,,9780747260332,The Catastrophist,,"Bennett, Ronan",313,,Review,"James Gillespie, an Irish writer, goes to the Congo in 1962, in pursuit of an Italian woman. What follows tells of the ebb and flow of their passion, the shimmering heat of Africa, the terrible collapse of the colonial regime, the murder of the African leader and general descent into unholy chaos.",,en,2024-02-25,,2024-02-26,,,,,,
35ADCE97-559B-40A0-A03A-2720618A0002,GEGNEAAAQBAJ,,9780385534260,The Wager,"A Tale of Shipwreck, Mutiny and Murder","Grann, David",352,,National Geographic Books,"From the #1 New York Times bestselling author of Killers of the Flower Moon, a page-turning story of shipwreck, survival, and savagery, culminating in a court martial that reveals a shocking truth. With the twists and turns of a thriller Grann unearths the deeper meaning of the events on the Wager, showing that it was not only the captain and crew who ended up on trial, but the very idea of empire.

On January 28, 1742, a ramshackle vessel of patched-together wood and cloth washed up on the coast of Brazil. Inside were thirty emaciated men, barely alive, and they had an extraordinary tale to tell. They were survivors of His Majesty’s Ship the Wager, a British vessel that had left England in 1740 on a secret mission during an imperial war with Spain. While the Wager had been chasing a Spanish treasure-filled galleon known as “the prize of all the oceans,” it had wrecked on a desolate island off the coast of Patagonia. The men, after being marooned for months and facing starvation, built the flimsy craft and sailed for more than a hundred days, traversing 2500 miles of storm-wracked seas. They were greeted as heroes.

But then ... six months later, another, even more decrepit craft landed on the coast of Chile. This boat contained just three castaways, and they told a very different story. The thirty sailors who landed in Brazil were not heroes – they were mutineers. The first group responded with countercharges of their own, of a tyrannical and murderous senior officer and his henchmen. It became clear that while stranded on the island the crew had fallen into anarchy, with warring factions fighting for dominion over the barren wilderness. As accusations of treachery and murder flew, the Admiralty convened a court martial to determine who was telling the truth. The stakes were life-and-death—for whomever the court found guilty could hang.

The Wager is a grand tale of human behavior at the extremes told by one of our greatest nonfiction writers. Grann’s recreation of the hidden world on a British warship rivals the work of Patrick O’Brian, his portrayal of the castaways’ desperate straits stands up to the classics of survival writing such as The Endurance, and his account of the court martial has the savvy of a Scott Turow thriller. As always with Grann’s work, the incredible twists of the narrative hold the reader spellbound.",Europe; Georgian Era (1714-1837); Great Britain; History; Maritime History & Piracy; Mass Murder; Murder; True Crime,en,2024-03-02,,2024-03-11,,,,,,
8DE55E51-A945-4ED8-8200-B7455EA72791,_B7BEAAAQBAJ,,9781804292303,The Price is Wrong,Why Capitalism Won't Save the Planet,"Christophers, Brett",432,,Verso Books,"""Standard theories of the causes of climate breakdown will not survive this book. Readers will be all the wiser.""
—Andreas Malm, author of How to Blow Up a Pipeline

Why the market will never solve the climate crisis

What if our understanding of capitalism and climate is back to front? What if the problem is not that transitioning to renewables is too expensive, but that saving the planet is not sufficiently profitable?

This is Brett Christophers' claim. The global economy is moving too slowly toward sustainability because the return on green investment is too low.

Today's consensus is that the key to curbing climate change is to produce green electricity and electrify everything possible. The main economic barrier in that project has seemingly been removed. But while prices of solar and wind power have tumbled, the golden era of renewables has yet to materialize.

The problem is that investment is driven by profit, not price, and operating solar and wind farms remains a marginal business, dependent everywhere on the state's financial support.

We cannot expect markets and the private sector to solve the climate crisis while the profits that are their lifeblood remain unappetizing. But there is an alternative to providing surrogate green profits through subsidies: to take energy out of the private sector's hands.

An essential intervention, The Price Is Wrong is as politically far-reaching as it is factually illuminating.","Communism, Post-Communism & Socialism; Economic Policy; Political Economy; Political Ideologies; Political Science; Public Policy",en,2024-04-01,,2024-05-17,,,,,,
4118E6FE-B9F2-4181-B34C-6C2393D82E81,76OKPwAACAAJ,,9780140099072,Ninety-Two in the Shade,,"McGuane, Thomas",197,,Penguin Books,"Tiring of the company of junkies and burn-outs, Thomas Skelton goes home to Key West to take up a more wholesome life. But things fester in America's utter South. And Skelton's plans to become a skiff guide in the shining blue subtropical waters place him on a collision course with Nichol Dance, who has risen to the crest of the profession by dint of infallible instincts and a reputation for homicide.",Fiction; Literary; Southern,en,2024-05-18,,2024-05-25,,,,,,
7D3D953E-918A-43D0-AD0C-3AA32D32D872,kEwfDgAAQBAJ,,9780465094462,The Boy Who Was Raised as a Dog,"And Other Stories from a Child Psychiatrist's Notebook -- What Traumatized Children Can Teach Us About Loss, Love, and Healing","Perry, Bruce D; Szalavitz, Maia",448,,Basic Books,"In this classic work of developmental psychology, renowned psychiatrist and the coauthor of the #1 New York Times bestseller What Happened to You? reveals how trauma affects children—and outlines the path to recovery

""Fascinating and upbeat...Dr. Perry is both a world-class creative scientist and a compassionate therapist.""—Mary Pipher, PhD, author of Reviving Ophelia

How does trauma affect a child's mind—and how can that mind recover?

Child psychiatrist Dr. Bruce D. Perry has helped children faced with unimaginable horror: genocide survivors, murder witnesses, kidnapped teenagers, and victims of family violence. In the classic The Boy Who Was Raised as a Dog, Dr. Perry tells their stories of trauma and transformation and shares their lessons of courage, humanity, and hope. Deftly combining unforgettable case histories with his own compassionate, insightful strategies for rehabilitation, Perry explains what happens to children’s brains when they are exposed to extreme stress—and reveals the unexpected measures that can be taken to ease such pain and help them grow into healthy adults. Only when we understand the science of the mind and the power of love and nurturing can we hope to heal the spirit of even the most wounded child.",Abuse; Child Abuse; Developmental; Family & Relationships; Post-Traumatic Stress Disorder (PTSD); Psychology; Psychopathology; Self-Help; Social Science; Violence in Society,en,2024-05-26,,2024-06-05,,,,,,
F7EDC5E7-3E19-4255-903E-177D6D583C64,1qlj0AEACAAJ,,9780008564742,Cuckooland,Where the Rich Own the Truth,"Burgis, Tom",320,,HarperCollins Publishers,"'Stand by for fireworks as it hits the shelves' SUNDAY TIMES

'If Orwell were with us today, he'd be writing books like this' PATRICK RADDEN KEEFE

'Breath-taking and jaw-dropping' PETER FRANKOPAN

'A true-life thriller' ANNE APPLEBAUM

From the bestselling author of Kleptopia comes a true story about Cuckooland - a world where the rich can buy everything - including the truth.

Everywhere, the powerful are making a renewed claim to the greatest prize of all: to own the truth. The power to choose what you want reality to be and impose that reality on the world.

For three years, Tom Burgis followed a lead that took him deeper and deeper into Cuckooland - the place where the rich own the truth. The trail snaked from the Kremlin to Kathmandu, Stockholm to the Steppe, from a blood-soaked town square in Uzbekistan to a royal retreat in Scotland. Burgis hunted down oligarchs, developed secret sources and traced vast sums of money flowing between multinational corporations, ex-Soviet dictators and the west's ruling elites. And he found one man who wanted the power to bend reality to his will.

This book tells an astonishing story: a tale of secrets and lies that reveals how fragile that truth can be. Whether it's in Kazakh torture chambers or the UK's High Court, the lords of Cuckooland are seizing control of the truth. They decree what stories may be told about war and money and power, what we are permitted to know - and more importantly, what we are not.

From the bestselling author of Kleptopia, Cuckooland is a deeply reported work of non-fiction that reads like a thriller. It is a story of how globalisation and technological revolution have combined to imperil the foundation of free societies: that the truth belongs to the many, not the few.",21st Century; Business & Economics; Corruption & Misconduct; Economic Conditions; Economics; History; LANGUAGE ARTS & DISCIPLINES; Linguistics; Modern; Political Science; Russia; True Crime; White Collar Crime,en,2024-06-06,,2024-06-08,,,,,,
00414BF7-0A3A-410D-944D-EBAFCCF204D9,dVoJtAEACAAJ,,9781408891957,Norse Mythology,,"Gaiman, Neil",282,,Bloomsbury,"THE NO. 1 SUNDAY TIMES AND NEW YORK TIMES BESTSELLER FROM THE AUTHOR OF NETFLIX HIT THE SANDMAN'With the deftest of touches, the characters are once again brought to life' JOANNE HARRIS'The halls of Valhalla have been crying out for Gaiman to tell their stories' OBSERVERThe great Norse myths, which have inspired so much of modern fiction, are dazzlingly retold by Neil Gaiman. Tales of dwarfs and frost giants, of treasure and magic, and of Asgard, home to the gods: Odin the all-father, highest and oldest of the Aesir; his mighty son Thor, whose hammer Mjollnir makes the mountain giants tremble; Loki, wily and handsome, reliably unreliable in his lusts; and Freya, more beautiful than the sun or the moon, who spurns those who seek to control her. From the dawn of the world to the twilight of the gods, this is a thrilling, vivid retelling of the Norse myths from the award-winning, bestselling Neil Gaiman.*This book has been printed with two different cover designs. We are unable to accept requests for a specific cover. The different covers will be assigned to orders at random*","Ancient; Epic; Fairy Tales, Folk Tales, Legends & Mythology; Fantasy; Fiction; Folklore & Mythology; Religion; Social Science",en,2024-06-09,,2024-06-10,,,,,,
B2B4A933-6BB5-439C-A086-6EAF064BDACD,rZdLzwEACAAJ,,9780061729072,The Doors of Perception and Heaven and Hell,,"Huxley, Aldous",208,,HarperCollins,"Half an hour after swallowing the drug I became aware of a slow dance of golden lights . . .

Among the most profound explorations of the effects of mind-expanding drugs ever written, here are two complete classic books—The Doors of Perception and Heaven and Hell—in which Aldous Huxley, author of the bestselling Brave New World, reveals the mind's remote frontiers and the unmapped areas of human consciousness. This new edition also features an additional essay, ""Drugs That Shape Men's Minds,"" which is now included for the first time.",Philosophy,en,2024-06-15,,2024-06-16,,,,,,
AAA6C264-7B5F-4853-9FB6-155A9FA10573,zQvfPibW-7wC,,9780199601202,Magnetism: A Very Short Introduction,,"Blundell, Stephen J.; Blundell, Stephen",142,,OUP Oxford,"Magnetism is a strange force, mysteriously attracting one object to another apparently through empty space. It has been claimed as a great healer, with magnetic therapies being proposed over the centuries and still popular today. Why are its mysterious important to solve? In this Very Short Introduction, Stephen J. Blundell explains why. For centuries magnetism has been used for various exploits; through compasses it gave us navigation and through motors, generators, and turbines it has given us power. Blundell explores our understanding of electricity and magnetism, from the work of Galvani, Ampere, Faraday, and Tesla, and goes on to explore how Maxwell and Faraday's work led to the unification of electricity and magnetism, thought of as one of the most imaginative developments in theoretical physics. With a discussion of the relationship between magnetism and relativity, quantum magnetism, and its impact on computers and information storage, Blundell shows how magnetism has changed our fundamental understanding of the Universe. ABOUT THE SERIES: The Very Short Introductions series from Oxford University Press contains hundreds of titles in almost every subject area. These pocket-sized books are the perfect way to get ahead in a new subject quickly. Our expert authors combine facts, analysis, perspective, new ideas, and enthusiasm to make interesting and challenging topics highly readable.","Body, Mind & Spirit; Electricity; Magnetism; Physics; Science",en,2024-06-17,,2024-06-22,,,,,,
8D6EB92B-AAAE-4BE5-9038-467A50407787,0Cy7DwAAQBAJ,,9780198813927,Energy Systems,,"Jenkins, Nick",152,,Oxford University Press,"Modern societies require energy systems to provide energy for cooking, heating, transport, and materials processing, as well as for electricity generation. Energy systems include the primary fuel, its conversion, and transport to the point of use. In many cases this primary fuel is still a fossil fuel, a one-use resource derived from a finite supply within our planet, causing considerable damage to the environment. After 300 years of increasing reliance on fossil fuels, particularly coal, it is becoming ever clearer that the present energy systems need to change.

In this Very Short Introduction Nick Jenkins explores our historic investment in the exploitation of fossil energy resources and their current importance, and discusses the implications of our increasing rate of energy use. He considers the widespread acceptance by scientists and policy makers that our energy systems must reduce emissions of CO2 and other greenhouse gases, and looks forward to the radical changes in fuel technology that will be necessary to continue to provide energy supplies in a sustainable manner, and extend access across the developing world. Considering the impact of changing to an environmentally benign and low-carbon energy system, Jenkins also looks at future low-carbon energy systems which would use electricity from a variety of renewable energy sources, as well as the role of nuclear power in our energy use.

ABOUT THE SERIES: The Very Short Introductions series from Oxford University Press contains hundreds of titles in almost every subject area. These pocket-sized books are the perfect way to get ahead in a new subject quickly. Our expert authors combine facts, analysis, perspective, new ideas, and enthusiasm to make interesting and challenging topics highly readable.",BUSINESS & ECONOMICS; Economics; Environmental Conservation & Protection; Environmental Science; Natural Resources; Nature; Science,en,2024-06-23,,2024-06-24,,,,,,
F590F1B5-0361-4033-8C50-2670B018F243,lyEExgEACAAJ,,9780802149077,This Boy's Life (30th Anniversary Edition),A Memoir,"Wolff, Tobias",336,,Grove Atlantic,"""A classic of the genre.""--New York Times

The 30th anniversary edition of Tobias Wolff's ""extraordinary memoir"" (SF Chronicle), now with a new introduction by the author.

Thirty years ago Tobias Wolff wrote a memoir that changed the form. The ""unforgettable"" (Time) This Boy's Life is the story of the young, tough-on-the-outside but vulnerable Toby Wolff. Separated by divorce from his father and brother, Toby and his mother travel from Florida to Utah to a small village in Washington state, with many stops along the way. As each place doesn't quite work out, they pick up to find somewhere new. In the story of their journey, Wolff masterfully recreates the frustrations, cruelties, and joys of adolescence and presents a deeply poignant exploration of memory, dreams, and how we create a self.",Abuse; Adolescence; Biography & Autobiography; Child Abuse; Divorce & Separation; Family & Relationships; Life Stages; Personal Memoirs,en,2024-07-01,,2024-07-20,,,,,,
8D1D69E4-6A7F-4068-93E0-74AA5FAB6AB1,uc8jzgEACAAJ,,9781542029391,The World Played Chess,,"Dugoni, Robert",400,,Amazon Publishing,"""A fearless and sensitive coming-of-age story. I loved it."" --Mark Sullivan, bestselling author of Beneath a Scarlet Sky and The Last Green Valley.

Bestselling author Robert Dugoni returns with an emotionally arresting follow-up to The Extraordinary Life of Sam Hell.

In 1979, Vincent Bianco has just graduated high school. His only desire: collect a little beer money and enjoy his final summer before college. So he lands a job as a laborer on a construction crew. Working alongside two Vietnam vets, one suffering from PTSD, Vincent gets the education of a lifetime. Now forty years later, with his own son leaving for college, the lessons of that summer--Vincent's last taste of innocence and first taste of real life--dramatically unfold in a novel about breaking away, shaping a life, and seeking one's own destiny.",Coming of Age; Family Life; Fiction; Literary,en,2024-07-21,,2024-07-21,,,,,,
95AB45C2-C920-48EF-8244-B90A6DCDA681,ORPmEAAAQBAJ,,9780593443958,The Infernal Machine,"A True Story of Dynamite, Terror, and the Rise of the Modern Detective","Johnson, Steven",368,,Crown,"“A fast-burning fuse of a book, every page bursting with revelatory detail.”—ERIK LARSON

A sweeping account of the anarchists who terrorized the streets of New York and the detective duo who transformed policing to meet the threat—a tale of fanaticism, forensic science, and dynamite from the bestselling author of The Ghost Map
 
Steven Johnson’s engrossing account of the epic struggle between the anarchist movement and the emerging surveillance state stretches around the world and between two centuries—from Alfred Nobel’s invention of dynamite and the assassination of Czar Alexander II to New York City in the shadow of World War I.

April 1914. The NYPD is still largely the corrupt, low-tech organization of the Tammany Hall era. To the extent the police are stopping crime—as opposed to committing it—their role has been almost entirely defined by physical force: the brawn of the cop on the beat keeping criminals at bay with nightsticks and fists. The solving of crimes is largely outside their purview.

The new commissioner, Arthur Woods, is determined to change that, but he cannot anticipate the maelstrom of violence that will soon test his science-based approach to policing. Within weeks of his tenure, New York City is engulfed in the most concentrated terrorism campaign in the nation’s history: a five-year period of relentless bombings, many of them perpetrated by the anarchist movement led by legendary radicals Alexander Berkman and Emma Goldman. Coming to Woods’s aide are Inspector Joseph Faurot, a science-first detective who works closely with him in reforming the police force, and Amadeo Polignani, the young Italian undercover detective who infiltrates the notorious Bresci Circle.

Johnson reveals a mostly forgotten period of political conviction, scientific discovery, assassination plots, bombings, undercover operations, and innovative sleuthing. The Infernal Machine is the complex pre-history of our current moment, when decentralized anarchist networks have once again taken to the streets to protest law enforcement abuses, right-wing militia groups have attacked government buildings, and surveillance is almost ubiquitous.",21st Century; History; Political Science; Security (National & International); Terrorism; United States,en,2024-07-22,,2024-07-23,,,,,,
20963516-8040-4FA4-903A-2454E147BED7,M86oEAAAQBAJ,,9781250854988,A Day in the Life of Abed Salama,Anatomy of a Jerusalem Tragedy,"Thrall, Nathan",304,,Henry Holt and Company,"WINNER OF THE 2024 PULITZER PRIZE FOR GENERAL NON-FICTION

Named a Best Book of the Year by The New Yorker, The Economist, Time, The New Republic, and the Financial Times.

Immersive and gripping, an intimate story of a deadly accident outside Jerusalem that unravels a tangle of lives, loves, enmities, and histories over the course of one revealing, heartbreaking day.

Five-year-old Milad Salama is excited for a school trip to a theme park on the outskirts of Jerusalem. On the way, his bus collides with a semitrailer. His father, Abed, gets word of the crash and rushes to the site. The scene is chaos—the children have been taken to different hospitals in Jerusalem and the West Bank; some are missing, others cannot be identified. Abed sets off on an odyssey to learn Milad’s fate. It is every parent’s worst nightmare, but for Abed it is compounded by the maze of physical, emotional, and bureaucratic obstacles he must navigate because he is Palestinian. He is on the wrong side of the separation wall, holds the wrong ID to pass the military checkpoints, and has the wrong papers to enter the city of Jerusalem. Abed’s quest to find Milad is interwoven with the stories of a cast of Jewish and Palestinian characters whose lives and histories unexpectedly converge.

In A Day in the Life of Abed Salama, Nathan Thrall—hailed for his “severe allergy to conventional wisdom” (Time)—offers an indelibly human portrait of the struggle over Israel/Palestine and a new understanding of the tragic history and reality of one of the most contested places on earth.",History; Israel & Palestine; Middle East; Middle Eastern; Political Science; Race & Ethnic Relations; Social Science; World,en,2024-07-23,,2024-07-24,,,,,,
3552E529-4F71-4C70-B6E2-1DA8C169516B,CRhPDQAAQBAJ,,9780143109679,Let My People Go Surfing,The Education of a Reluctant Businessman--Including 10 More Years of Business Unusual,"Chouinard, Yvon",272,,Penguin,"""Wonderful . . . a moving autobiography, the story of a unique business, and a detailed blueprint for hope."" —Jared Diamond, Pulitzer Prize-winning author of Guns, Germs, and Steel

In this 10th anniversary edition, Yvon Chouinard—legendary climber, businessman, environmentalist, and founder of Patagonia, Inc.—shares the persistence and courage that have gone into being head of one of the most respected and environmentally responsible companies on earth.

 From his youth as the son of a French Canadian handyman to the thrilling, ambitious climbing expeditions that inspired his innovative designs for the sport's equipment, Let My People Go Surfing is the story of a man who brought doing good and having grand adventures into the heart of his business life-a book that will deeply affect entrepreneurs and outdoor enthusiasts alike.",Biography & Autobiography; Business & Economics; Environmental Conservation & Protection; Management; Nature; Personal Memoirs,en,2024-07-25,,2024-07-27,,,,,,
