Reading List ID,Google Books ID,Apple Books ID,ISBN-13,Title,Subtitle,Authors,Page Count,Publication Date,Publisher,Description,Subjects,Language Code,Started Reading,Paused,Finished Reading,Did Not Finish,Current Page,Current Percentage,Rating,Notes,Lists
7DC2620B-8580-4F54-A5FA-20201D3E4F4B,T2gXuwEACAAJ,,9781681373270,Stalingrad,,"Grossman, Vasily",1088,,New York Review Books,"The prequel to Vasily Grossman's Life and Fate, the War and Peace of the 20th Century, now in English for the first time.

In April 1942, Hitler and Mussolini meet in Salzburg where they agree on a renewed assault on the Soviet Union. Launched in the summer, the campaign soon picks up speed, as the routed Red Army is driven back to the industrial center of Stalingrad on the banks of the Volga. In the rubble of the bombed-out city, Soviet forces dig in for a last stand.

The story told in Vasily Grossman's Stalingrad unfolds across the length and breadth of Russia and Europe, and its characters include mothers and daughters, husbands and brothers, generals, nurses, political activists, steelworkers, and peasants, along with Hitler and other historical figures. At the heart of the novel is the Shaposhnikov family. Even as the Germans advance, the matriarch, Alexandra Vladimirovna, refuses to leave Stalingrad. Far from the front, her eldest daughter, Ludmila, is unhappily married to the Jewish physicist Viktor Shtrum. Viktor's research may be of crucial military importance, but he is distracted by thoughts of his mother in the Ukraine, lost behind German lines.

In Stalingrad, published here for the first time in English translation, and in its celebrated sequel, Life and Fate, Grossman writes with extraordinary power and deep compassion about the disasters of war and the ruthlessness of totalitarianism, without, however, losing sight of the little things that are the daily currency of human existence or of humanity's inextinguishable, saving attachment to nature and life. Grossman's two-volume masterpiece can now be seen as one of the supreme accomplishments of twentieth-century literature, tender and fearless, intimate and epic.",Fiction; Historical; Political; War & Military; World War II,en,2019-08-27,,2019-09-25,,,,,,
04C46FAB-B8E3-42DC-99BC-C7683B0525CB,OM0yYoT-Uz8C,,9780060970208,Children of Alcoholism,,"Seixas, Judith S.",224,,Harper Collins,"If one or both of your parents were alcoholics ... you are still suffering, and you care not alone.

At least 22 million American adults were raised by an alcoholic parent, and nearly all of them live with scars -- both psychological and physical -as a consequence. Coming from homes filled with loneliness and terror, children of alcoholics grow up unable to lead lives free from inexplicable guilt, deep insecurity, lack of self-esteem, and intense sadness. Now there is help.

Chidren of Alcoholism exposes ""the terrible family secret"" and draws on interviews with over 200 survivors to share the realities of family alcoholism, such as the frequent occurrence of child abuse, the ruined family holidays, the ""crazy"" fantasylike atmosphere of the alcoholic home. Childern of Alcoholism also discusses in detail how survivors can:

tend to become alcoholics themselves, or marry alcoholic partners

confront addictive behavior, including alcoholism

recognize symptoms

openly discuss drinking with their own children

Filled with invaluable techniques for reversing destructive patterns and extensive information on therapy and peer support groups Children of Alcoholism offers objective, sympathetic advice on how to come to terms with the past and how to seek additional help if necessary.",Self-Help,en,2019-09-25,,2019-09-27,,,,,,
C7698533-BB73-446A-9FF0-ACD9D11C0237,5e4x9PoeGcoC,,9781933633633,Every Man Dies Alone,,"Fallada, Hans",543,,Melville House,"This never-before-translated masterpiece—by a heroic best-selling writer who saw his life crumble when he wouldn't join the Nazi Party—is based on a true story.

It presents a richly detailed portrait of life in Berlin under the Nazis and tells the sweeping saga of one working-class couple who decides to take a stand when their only son is killed at the front. With nothing but their grief and each other against the awesome power of the Reich, they launch a simple, clandestine resistance campaign that soon has an enraged Gestapo on their trail, and a world of terrified neighbors and cynical snitches ready to turn them in.

In the end, it's more than an edge-of-your-seat thriller, more than a moving romance, even more than literature of the highest order—it's a deeply stirring story of two people standing up for what's right, and for each other.",Classics; Fiction,en,2019-09-25,,2019-10-03,,,,,,
4C7FCAB4-07AC-4E04-80AC-36E9AE6E68F4,9Iwc1I8d4rIC,,9780691138152,The Age of Anxiety,A Baroque Eclogue,"Auden, W. H.",144,,Princeton University Press,"When it was first published in 1947, The Age of Anxiety--W. H. Auden's last, longest, and most ambitious book-length poem--immediately struck a powerful chord, capturing the imagination of the cultural moment that it diagnosed and named. Beginning as a conversation among four strangers in a barroom on New York's Third Avenue, Auden's analysis of Western culture during the Second World War won the Pulitzer Prize and inspired a symphony by Leonard Bernstein as well as a ballet by Jerome Robbins. Yet reviews of the poem were sharply divided, and today, despite its continuing fame, it is unjustly neglected by readers.

This volume--the first annotated, critical edition of the poem--introduces this important work to a new generation of readers by putting it in historical and biographical context and elucidating its difficulties. Alan Jacobs's introduction and thorough annotations help today's readers understand and appreciate the full richness of a poem that contains some of Auden's most powerful and beautiful verse, and that still deserves a central place in the canon of twentieth-century poetry.","American; English, Irish, Scottish, Welsh; European; Literary Criticism; Poetry",en,2019-10-05,,2019-10-06,,,,,,
6199B05D-3C31-407E-8704-D4C44AD48D71,xBBouwEACAAJ,,9781783784462,Ghost Wall,,"Moss, Sarah",160,,Granta Books,"It is high summer in rural Northumberland. Seventeen-year-old Silvie and her parents have joined an encampment run by an archaeology professor with an interest in the region's dark history of ritual sacrifice. As Silvie finds a glimpse of new freedoms with the professor's students, her relationship with her overbearing father begins to deteriorate, until the haunting rites of the past begin to bleed into the present.",,en,2019-10-06,,2019-10-11,,,,,,
016BF2C2-6B48-4B01-B770-A444814ECEC6,VAvsDAAAQBAJ,,9780698188396,Priestdaddy,A Memoir,"Lockwood, Patricia",352,,Penguin,"ONE OF THE NEW YORK TIMES BOOK REVIEW'S 10 BEST BOOKS OF 2017

NAMED ONE OF THE 50 BEST MEMOIRS OF THE PAST 50 YEARS BY THE NEW YORK TIMES

SELECTED AS A BEST BOOK OF THE YEAR BY: 
The Washington Post * Elle * NPR * New York Magazine * Boston Globe * Nylon * Slate * The Cut * The New Yorker * Chicago Tribune

WINNER OF THE 2018 THURBER PRIZE FOR AMERICAN HUMOR

 “Affectionate and very funny . . . wonderfully grounded and authentic.  This book proves Lockwood to be a formidably gifted writer who can do pretty much anything she pleases.” – The New York Times Book Review

From Patricia Lockwood—a writer acclaimed for her wildly original voice—a vivid, heartbreakingly funny memoir about balancing identity with family and tradition. 

Father Greg Lockwood is unlike any Catholic priest you have ever met—a man who lounges in boxer shorts, loves action movies, and whose constant jamming on the guitar reverberates “like a whole band dying in a plane crash in 1972.” His daughter is an irreverent poet who long ago left the Church’s country. When an unexpected crisis leads her and her husband to move back into her parents’ rectory, their two worlds collide.

In Priestdaddy, Lockwood interweaves emblematic moments from her childhood and adolescence—from an ill-fated family hunting trip and an abortion clinic sit-in where her father was arrested to her involvement in a cultlike Catholic youth group—with scenes that chronicle the eight-month adventure she and her husband had in her parents’ household after a decade of living on their own. Lockwood details her education of a seminarian who is also living at the rectory, tries to explain Catholicism to her husband, who is mystified by its bloodthirstiness and arcane laws, and encounters a mysterious substance on a hotel bed with her mother.

Lockwood pivots from the raunchy to the sublime, from the comic to the deeply serious, exploring issues of belief, belonging, and personhood. Priestdaddy is an entertaining, unforgettable portrait of a deeply odd religious upbringing, and how one balances a hard-won identity with the weight of family and tradition.",Biography & Autobiography; Humor; Personal Memoirs; Religion; Topic; Women,en,2019-10-13,,2019-10-17,,,,,,
C157B3FF-6DC4-47D0-98C5-5B5801A27579,iRuoDwAAQBAJ,,9781635574333,The Anarchy,"The East India Company, Corporate Violence, and the Pillage of an Empire","Dalrymple, William",544,,Bloomsbury Publishing USA,"“Superb ... A vivid and richly detailed story ... worth reading by everyone.” -The New York Times Book Review

From the bestselling author of Return of a King, the story of how the East India Company took over large swaths of Asia, and the devastating results of the corporation running a country.

In August 1765, the East India Company defeated the young Mughal emperor and set up, in his place, a government run by English traders who collected taxes through means of a private army.

The creation of this new government marked the moment that the East India Company ceased to be a conventional company and became something much more unusual: an international corporation transformed into an aggressive colonial power. Over the course of the next 47 years, the company's reach grew until almost all of India south of Delhi was effectively ruled from a boardroom in the city of London.

The Anarchy tells one of history's most remarkable stories: how the Mughal Empire-which dominated world trade and manufacturing and possessed almost unlimited resources-fell apart and was replaced by a multinational corporation based thousands of miles overseas, and answerable to shareholders, most of whom had never even seen India and no idea about the country whose wealth was providing their dividends. Using previously untapped sources, Dalrymple tells the story of the East India Company as it has never been told before and provides a portrait of the devastating results from the abuse of corporate power.",18th Century; Asia; Biography & Autobiography; Business; Business & Economics; Colonialism & Post-Colonialism; Economic History; Europe; Great Britain; History; India & South Asia; International; Military; Military Science; Modern; Naval; Political Science; Renaissance; Technology & Engineering; Wars & Conflicts (Other),en,2019-10-17,,2019-10-24,,,,,,
06698AE1-3DC9-4042-B10F-02A81D708A75,s_LBvQEACAAJ,,9781784875381,Blood River,Vintage Voyages,"Butcher, Tim",384,,Penguin Random House,"A compulsively readable account of an African country now virtually inaccessible to the outside world and one journalist's daring and adventurous journey.

When Daily Telegraph correspondent Tim Butcher was sent to cover Africa he quickly became obsessed with the idea of recreating H.M. Stanley's famous expedition - but travelling alone. Despite warnings that his plan was 'suicidal', Butcher set out for the Congo's eastern border with just a rucksack and a few thousand dollars hidden in his boots. Making his way in an assortment of vessels including a motorbike and a dugout canoe, helped along by a cast of characters from UN aid workers to a campaigning pygmy, he followed in the footsteps of the great Victorian adventurers.

VINTAGE VOYAGES: A world of journeys, from the tallest mountains to the depths of the mind",,en,2019-10-24,,2019-10-26,,,,,,
46E27E89-D45C-4AF9-BF6E-40143A995FD8,rBDHGXK1CKcC,,9780060956394,The White Nile,,"Moorehead, Alan",448,,Harper Collins,"Relive all the thrills and adventure of Alan Moorehead's classic bestseller The White Nile -- the daring exploration of the Nile River in the second half of the nineteenth century, which was at that time the most mysterious and impenetrable region on earth. Capturing in breathtaking prose the larger-than-life personalities of such notable figures as Stanley, Livingstone, Burton and many others, The White Nile remains a seminal work in tales of discovery and escapade, filled with incredible historical detail and compelling stories of heroism and drama.",Adventure; Special Interest; Travel,en,2019-10-27,,2019-11-03,,,,,,
0142FF5B-70D6-449D-AB6F-7660C262A4B1,F_DsNWK_RkYC,,9780060956400,The Blue Nile,,"Moorehead, Alan",368,,Harper Collins,"In the first half of the nineteenth century, only a small handful of Westerners had ventured into the regions watered by the Nile River on its long journey from Lake Tana in Abyssinia to the Mediterranean-lands that had been forgotten since Roman times, or had never been known at all. In The Blue Nile, Alan Moorehead continues the classic, thrilling narration of adventure he began in The White Nile, depicting this exotic place through the lives of four explorers so daring they can be considered among the world's original adventurers -- each acting and reacting in separate expeditions against a bewildering background of slavery and massacre, political upheaval and all-out war.",Adventure; Special Interest; Travel,en,2019-11-03,,2019-11-10,,,,,,
6F08CD2B-6FE2-4C56-8444-BDE06058A164,9ZTKqggICOwC,,9781935633242,Chasing the Devil: A Journey Through Sub-Saharan Africa in the Footsteps of Graham Greene,,"Butcher, Tim",325,,Atlas and Company,"The audacious, gripping travelogue of a writer chasing the ghost of Graham Greene into the heart of Africa.

Of all the anarchic and war-torn African nations, none is more forbidding than Liberia, the land that nurtured child soldiers, the violent trade in ""blood diamonds,"" even ritual murder. Graham Greene, in search of extreme adventure, ventured through its dense jungles to write the travel classic Journey Without Maps; three-quarters of a century later, Tim Butcher decided to follow Greene's footsteps, only to find the path even more ominous and overgrown than in his predecessor's day. Among the devils he encounters are masked sorcerers whose magical powers depend on cannibalism and missionaries long forgotten in the hinterland he traverses. Butcher, a former African correspondent for the London Telegraph and author of Blood River, his best-selling account of a dramatic journey through the Congo, has produced in this thrilling sequel a book that The Independent hails as ""fascinating, harrowing, and eventful.""",Essays & Travelogues; Travel,en,2019-11-10,,2019-11-12,,,,,,
1BCC1774-643E-497B-887B-847D95A1F062,FfiryAEACAAJ,,,Remote People,,"Waugh, Evelyn",240,,Duckworth,"Travels in Abyssinia, South Arabia, Zanzibar, Kenya, Tanganyika, Uganda and Congo.",,en,2019-11-13,,2019-11-16,,,,,,
AA5D371D-6ABF-40F6-9918-6EFF6960A0AD,jrPnDQAAQBAJ,,9780062565723,WTF?,What's the Future and Why It's Up to Us,"O'Reilly, Tim",448,,HarperCollins,"WTF? can be an expression of amazement or an expression of dismay. In today’s economy, we have far too much dismay along with our amazement, and technology bears some of the blame. In this combination of memoir, business strategy guide, and call to action, Tim O'Reilly, Silicon Valley’s leading intellectual and the founder of O’Reilly Media, explores the upside and the potential downsides of today's WTF? technologies.

What is the future when an increasing number of jobs can be performed by intelligent machines instead of people, or done only by people in partnership with those machines? What happens to our consumer based societies—to workers and to the companies that depend on their purchasing power? Is income inequality and unemployment an inevitable consequence of technological advancement, or are there paths to a better future? What will happen to business when technology-enabled networks and marketplaces are better at deploying talent than traditional companies? How should companies organize themselves to take advantage of these new tools? What’s the future of education when on-demand learning outperforms traditional institutions? How can individuals continue to adapt and retrain? Will the fundamental social safety nets of the developed world survive the transition, and if not, what will replace them?

O'Reilly is ""the man who can really can make a whole industry happen,"" according to Eric Schmidt, Executive Chairman of Alphabet (Google.) His genius over the past four decades has been to identify and to help shape our response to emerging technologies with world shaking potential—the World Wide Web, Open Source Software, Web 2.0, Open Government data, the Maker Movement, Big Data, and now AI. O’Reilly shares the techniques he's used at O’Reilly Media  to make sense of and predict past innovation waves and applies those same techniques to provide a framework for thinking about how today’s world-spanning platforms and networks, on-demand services, and artificial intelligence are changing the nature of business, education, government, financial markets, and the economy as a whole. He provides tools for understanding how all the parts of modern digital businesses work together to create marketplace advantage and customer value, and why ultimately, they cannot succeed unless their ecosystem succeeds along with them.

The core of the book's call to action is an exhortation to businesses to DO MORE with technology rather than just using it to cut costs and enrich their shareholders. Robots are going to take our jobs, they say. O'Reilly replies, “Only if that’s what we ask them to do! Technology is the solution to human problems, and we won’t run out of work till we run out of problems."" Entrepreneurs need to set their sights on how they can use big data, sensors, and AI to create amazing human experiences and the economy of the future, making us all richer in the same way the tools of the first industrial revolution did. Yes, technology can eliminate labor and make things cheaper, but at its best, we use it to do things that were previously unimaginable! What is our poverty of imagination? What are the entrepreneurial leaps that will allow us to use the technology of today to build a better future, not just a more efficient one? Whether technology brings the WTF? of wonder or the WTF? of dismay isn't inevitable. It's up to us!",Business & Economics; Business Ethics; Development; Economic Development; Inventions; Technology & Engineering,en,2019-11-16,,2019-11-16,,,,,,
E5061EF9-FC21-4DCC-BB75-128DAB9EFB9D,VBjmYRBXZLsC,,9781590173220,The Way of the World,,"Bouvier, Nicolas",318,,New York Review of Books,"In 1953, twenty-four-year old Nicolas Bouvier and his artist friend Thierry Vernet set out to make their way overland from their native Geneva to the Khyber Pass. They had a rattletrap Fiat and a little money, but above all they were equipped with the certainty that by hook or by crook they would reach their destination, and that there would be unanticipated adventures, curious companionship, and sudden illumination along the way.The Way of the World, which Bouvier fashioned over the course of many years from his journals, is an entrancing story of adventure, an extraordinary work of art, and a voyage of self-discovery on the order of Robert M. Pirsig'sZen and the Art of Motorcycle Maintenance. As Bouvier writes, “You think you are making a trip, but soon it is making—or unmaking—you.”",Asia; Biography & Autobiography; Essays & Travelogues; Personal Memoirs; Travel,en,2019-11-24,,2019-12-01,,,,,,
738FB3D9-A3CE-4E87-9889-82A20CD75359,IDY-AQAAIAAJ,,,The ascent of Rum Doodle,,"Bowman, William Ernest",141,,Vanguard Press,,,en,2019-12-01,,2019-12-01,,,,,,
20B8412D-3165-43AD-BD06-8BFD95B41E22,HRA-PgAACAAJ,,9780143105510,The Snow Leopard,,"Matthiessen, Peter",336,,Penguin Books,"An unforgettable spiritual journey through the Himalayas by renowned writer Peter Matthiessen (1927-2014), the National Book Award-winning author of the new novel In Paradise

In 1973, Peter Matthiessen and field biologist George Schaller traveled high into the remote mountains of Nepal to study the Himalayan blue sheep and possibly glimpse the rare and beautiful snow leopard. Matthiessen, a student of Zen Buddhism, was also on a spiritual quest to find the Lama of Shey at the ancient shrine on Crystal Mountain. As the climb proceeds, Matthiessen charts his inner path as well as his outer one, with a deepening Buddhist understanding of reality, suffering, impermanence, and beauty. This Penguin Classics edition features an introduction by acclaimed travel writer and novelist Pico Iyer.

For more than seventy years, Penguin has been the leading publisher of classic literature in the English-speaking world. With more than 1,700 titles, Penguin Classics represents a global bookshelf of the best works throughout history and across genres and disciplines. Readers trust the series to provide authoritative texts enhanced by introductions and notes by distinguished scholars and contemporary authors, as well as up-to-date translations by award-winning translators.",Essays; Essays & Travelogues; Nature; Travel,en,2019-12-02,,2019-12-04,,,,,,
F3D3F699-5E0F-4333-B4F1-4F3B1B214C82,NciUAwAAQBAJ,,9781101663196,The Tree Where Man Was Born,,"Matthiessen, Peter",304,,Penguin,"A timeless and majestic portrait of Africa by renowned writer Peter Matthiessen (1927-2014), author of the National Book Award-winning The Snow Leopard and the new novel In Paradise

A finalist for the National Book Award when it was released in 1972, this vivid portrait of East Africa remains as fresh and revelatory now as on the day it was first published. Peter Matthiessen exquisitely combines nature and travel writing to portray the sights, scenes, and people he observed firsthand in several trips over the course of a dozen years. From the daily lives of wild herdsmen and the drama of predator kills to the field biologists investigating wild creatures and the anthropologists seeking humanity's origins in the rift valley, The Tree Where Man Was Born is a classic of journalistic observation. This Penguin Classics edition features an introduction by groundbreaking British primatologist Jane Goodall.

For more than seventy years, Penguin has been the leading publisher of classic literature in the English-speaking world. With more than 1,700 titles, Penguin Classics represents a global bookshelf of the best works throughout history and across genres and disciplines. Readers trust the series to provide authoritative texts enhanced by introductions and notes by distinguished scholars and contemporary authors, as well as up-to-date translations by award-winning translators.",Essays; Essays & Travelogues; Evolution; Life Sciences; Nature; Science; Travel,en,2019-12-05,,2019-12-12,,,,,,
7E6F941B-EDA0-4FB4-94E7-745C3B0F97A5,otrz-KkRIBEC,,9780226500607,A River Runs Through It,,"Maclean, Norman",161,,University of Chicago Press,"From its first magnificent sentence, ""In our family, there was no clear line between religion and fly fishing"", to the last, ""I am haunted by waters"", A River Runs Through It is an American classic.

Based on Norman Maclean's childhood experiences, A River Runs Through It has established itself as one of the most moving stories of our time; it captivates readers with vivid descriptions of life along Montana's Big Blackfoot River and its near magical blend of fly fishing with the troubling affections of the heart.

This handsome edition is designed and illustrated by Barry Moser. There are thirteen two-color wood engravings.

""A masterpiece. . . . This is more than stunning fiction: It is a lyric record of a time and a life, shining with Maclean's special gift for calling the reader's attention to arts of all kinds—the arts that work in nature, in personality, in social intercourse, in fly-fishing.""—Kenneth M. Pierce, Village Voice

""Wise, witty, wonderful, Maclean spins his tales, casts his flies, fishes the rivers and woods for what he remembers of his youth in the Rockies.""—Barbara Bannon, Publishers Weekly

""Maclean's book is surely destined to be one of those rare memoirs that can be called a masterpiece. . . . Earthy, whimsical, authoritative, wise; it touches the heart without blushing and traces lasting images for the eye. . . . This book is a gem.""—Nick Lyons, Fly-Fisherman",Biographical; Biography & Autobiography; Fiction,en,2019-12-24,,2019-12-25,,,,,,
