Reading List ID,Google Books ID,Apple Books ID,ISBN-13,Title,Subtitle,Authors,Page Count,Publication Date,Publisher,Description,Subjects,Language Code,Started Reading,Paused,Finished Reading,Did Not Finish,Current Page,Current Percentage,Rating,Notes,Lists
6FD374B3-736B-4D53-BB6D-8CF63791E123,LZeziL1kc1YC,,9781442964679,One from Many,Visa and the Rise of Chaordic Organization: Easyread Large Edition,"Hock, Dee",484,,ReadHowYouWant.com,"Few even well-informed business leaders seem to recognize Visa as the largest business organization in the world, despite a turnover that is some 10 times that of Wal-Mart and a market value that is, conservatively speaking, more than double that of General Electric. I have often wondered why this is so. How could the world's largest business also be one of the business world's best kept secrets? It is certainly not that its product is little known, nor that it is the leader of an obscure industry. There are few companies that could claim that one-sixth of the world's people were its customers last year! Yet, over the past decade, there have been well over a thousand feature articles in Business Week, Fortune, and Forbes on Microsoft, over 350 on GE, and about 35 on Visa.",Banks & Banking; Business & Economics,en,2021-01-02,,2021-01-03,,,,,,
46F2201C-0AB0-4064-85CF-95F3D3EA4EA0,Hl2pugEACAAJ,,9781732265110,The Dream Machine,,"Waldrop, M. Mitchell",527,,Stripe Press,"The year is 1962. More than a decade will pass before personal computers emerge from the garages of Silicon Valley, and a full thirty years before the Internet explosion of the 1990s. The word computer still has an ominous tone, conjuring up the image of a huge, intimidating device hidden away in an overlit, air-conditioned basement, relentlessly processing punch cards for some large institution: them. Yet, sitting in a nondescript office in Robert McNamara's Pentagon, a quiet forty-seven-year-old civilian is already planning the revolution that will change forever the way computers are perceived. Somehow, the occupant of that office - a former MIT psychologist named J.C.R. Licklider - has seen a future in which computers will empower individuals, instead of forcing them into rigid conformity. He is almost alone in his conviction that computers can become not just superfast calculating machines but joyful machines: tools that will serve as new media of expression, inspirations to creativity, and gateways to a vast world of on line information. And now he is determined to use the Pentagon's money to make that vision a reality.",,en,2021-01-04,,2021-01-17,,,,,,
648876F4-65E9-4B63-AD45-85A8F8C728C8,VkMovgAACAAJ,,9780231175722,Venture Investing in Science,,"Jamison, Douglas W.; Waite, Stephen R.",280,,Columbia University Press,"Over the past decade, software companies have increasingly monopolized the flow of venture capital, starving support for scientific research and its transformative discoveries. New medicines, cheaper and faster personal computers, and other life-changing developments all stem from investment in science. In the past, these funds led to steam engines, light bulbs, microprocessors, 3D printers, and even the Internet. In Venture Investing in Science, the venture capitalist Douglas W. Jamison and the investment author Stephen R. Waite directly link financial support to revolutionary advancements in physics, computers, chemistry, and biology and make a passionate case for continued investing in science to meet the global challenges of our time.

Clean air and water, cures for intractable diseases, greener public transportation, cheaper and faster communication technologies--these are some of the rich opportunities awaiting venture capital investment today. Jamison and Waite focus on how early-stage companies specializing in commercializing transformative technologies based on deep science have been shunned by venture capitalists, and how the development of such companies have been hampered by structural changes in capital markets and government regulation over the past decade. The authors argue that reinvigorating science-based technological innovation is crucial to reactivating the economic dynamism that lifts living standards and fuels prosperity over time.",,en,2021-01-14,,2021-01-18,,,,,,
BC3D597C-5D82-483E-9707-DBBD29FAD909,KFoSwQEACAAJ,,9780385539302,The Body,A Guide for Occupants,"Bryson, Bill",464,,Doubleday,"AN INSTANT NEW YORK TIMES BESTSELLER
NAMED A BEST BOOK OF THE YEAR BY THE WASHINGTON POST
LONGLISTED FOR THE PEN E.O. WILSON LITERARY SCIENCE WRITING AWARD

Glorious. . .You will marvel at the brilliance and vast weirdness of your design. --The Washington Post 

Bill Bryson, bestselling author of A Short History of Nearly Everything, takes us on a head-to-toe tour of the marvel that is the human body. As addictive as it is comprehensive, this is Bryson at his very best, a must-read owner's manual for everybody.

Bill Bryson once again proves himself to be an incomparable companion as he guides us through the human body--how it functions, its remarkable ability to heal itself, and (unfortunately) the ways it can fail. Full of extraordinary facts (your body made a million red blood cells since you started reading this) and irresistible Bryson-esque anecdotes, The Body will lead you to a deeper understanding of the miracle that is life in general and you in particular. As Bill Bryson writes, We pass our existence within this wobble of flesh and yet take it almost entirely for granted. The Body will cure that indifference with generous doses of wondrous, compulsively readable facts and information.",Adulthood & Aging; Anatomy; Developmental; HUMOR; Human Anatomy & Physiology; Life Sciences; Medical; Psychology; Science,en,2021-01-18,,2021-01-25,,,,,,
940DB025-E839-49ED-BD3F-915BFA89C031,wkjWDwAAQBAJ,,9780691208602,The Code of Capital,How the Law Creates Wealth and Inequality,"Pistor, Katharina",320,,Princeton University Press,"""Capital is the defining feature of modern economies, yet most people have no idea where it actually comes from. What is it, exactly, that transforms mere wealth into an asset that automatically creates more wealth? The Code of Capital explains how capital is created behind closed doors in the offices of private attorneys, and why this little-known fact is one of the biggest reasons for the widening wealth gap between the holders of capital and everybody else. In this revealing book, Katharina Pistor argues that the law selectively ""codes"" certain assets, endowing them with the capacity to protect and produce private wealth. With the right legal coding, any object, claim, or idea can be turned into capital - and lawyers are the keepers of the code. Pistor describes how they pick and choose among different legal systems and legal devices for the ones that best serve their clients' needs, and how techniques that were first perfected centuries ago to code landholdings as capital are being used today to code stocks, bonds, ideas, and even expectations--assets that exist only in law. A powerful new way of thinking about one of the most pernicious problems of our time, The Code of Capital explores the different ways that debt, complex financial products, and other assets are coded to give financial advantage to their holders. This provocative book paints a troubling portrait of the pervasive global nature of the code, the people who shape it, and the governments that enforce it.""--Provided by publisher.",Business & Economics; Business & Financial; Economic Policy; Economics; Law; Political Science; Public Policy; Securities; Social Classes & Economic Disparity; Social Science,en,2021-01-26,,2021-02-05,,,,,,
C097EC01-F11E-442D-A2F5-DA09C0DA48E5,qD-1vAEACAAJ,,9781732265141,The Revolt of the Public,And the Crisis of Authority in the New Millennium,"Gurri, Martin",445,,Stripe Press,"Riding a tsunami of information, the public has trampled on the temples of authority in every domain of human activity, everywhere. The Revolt of the Public tells the story of how ordinary people, gifted amateurs networked in communities of interest, have swarmed over the hierarchies of accredited professionals, questioned their methods, and shouted their failures from the digital rooftops. In science, business, media - and, pre-eminently, in politics and government - established elites have lost the power to command attention and set the agenda.The consequences have been revolutionary. Insurgencies enabled by digital devices and a vast information sphere have mobilized millions, toppling dictators in Egypt and Tunisia, crushing the ruling Socialist Party in Spain, inspiring ""Tea Parties"" and ""Occupations"" in the United States. Trust in political authority stands at an all-time low around the world. The Revolt of the Public analyzes the composition of the public, the nature of authority and legitimacy, and the part played by the perturbing agent: information. A major theme of the book is whether democratic institutions can survive the assaults of a public that at times appears to be at war with any form of organization, if not with history itself.",,en,2021-02-06,,2021-02-10,,,,,,
543D3573-38D8-4D51-BDFC-6EF9FA121621,LNE0jgEACAAJ,,9780691169330,On the Medieval Origins of the Modern State,,"Strayer, Joseph R.",114,,Princeton University Press,"The modern state, however we conceive of it today, is based on a pattern that emerged in Europe in the period from 1100 to 1600. Inspired by a lifetime of teaching and research, On the Medieval Origins of the Modern State is a classic work on what is known about the early history of the European state. This short, clear book book explores the European state in its infancy, especially in institutional developments in the administration of justice and finance. Forewords from Charles Tilly and William Chester Jordan demonstrate the perennial importance of Joseph Strayer's book, and situate it within a contemporary context. Tilly demonstrates how Strayer's work has set the agenda for a whole generation of historical analysts, not only in medieval history but also in the comparative study of state formation. William Chester Jordan's foreword examines the scholarly and pedagogical setting within which Strayer produced his book, and how this both enhanced its accessibility and informed its focus on peculiarly English and French accomplishments in early state formation.",Europe; History; History & Theory; Medieval; Political Science,en,2021-02-10,,2021-02-12,,,,,,
0EB671DF-9808-418A-A036-A7AFC70898A6,l3y7DQAAQBAJ,,9781555975845,Life on Mars,Poems,"Smith, Tracy K.",75,,Macmillan,"Winner of the 2012 Pulitzer Prize

* Poet Laureate of the United States *
* A New York Times Notable Book of 2011 and New York Times Book Review Editors' Choice *
* A New Yorker, Library Journal and Publishers Weekly Best Book of the Year *

New poetry by the award-winning poet Tracy K. Smith, whose ""lyric brilliance and political impulses never falter"" (Publishers Weekly, starred review)

You lie there kicking like a baby, waiting for God himself
To lift you past the rungs of your crib. What
Would your life say if it could talk?
 —from ""No Fly Zone""


With allusions to David Bowie and interplanetary travel, Life on Mars imagines a soundtrack for the universe to accompany the discoveries, failures, and oddities of human existence. In these brilliant new poems, Tracy K. Smith envisions a sci-fi future sucked clean of any real dangers, contemplates the dark matter that keeps people both close and distant, and revisits the kitschy concepts like ""love"" and ""illness"" now relegated to the Museum of Obsolescence. These poems reveal the realities of life lived here, on the ground, where a daughter is imprisoned in the basement by her own father, where celebrities and pop stars walk among us, and where the poet herself loses her father, one of the engineers who worked on the Hubble Space Telescope. With this remarkable third collection, Smith establishes herself among the best poets of her generation.",African American; American; Poetry; Women Authors,en,2021-02-12,,2021-02-13,,,,,,
56A9A0CD-01FB-457D-996D-A618EFBDDE7F,Nr74DwAAQBAJ,,9780262572330,Protocol,How Control Exists After Decentralization,"Galloway, Alexander R.",260,,MIT Press,"How Control Exists after Decentralization

Is the Internet a vast arena of unrestricted communication and freely exchanged information or a regulated, highly structured virtual bureaucracy? In Protocol, Alexander Galloway argues that the founding principle of the Net is control, not freedom, and that the controlling power lies in the technical protocols that make network connections (and disconnections) possible. He does this by treating the computer as a textual medium that is based on a technological language, code. Code, he argues, can be subject to the same kind of cultural and literary analysis as any natural language; computer languages have their own syntax, grammar, communities, and cultures. Instead of relying on established theoretical approaches, Galloway finds a new way to write about digital media, drawing on his backgrounds in computer programming and critical theory. ""Discipline-hopping is a necessity when it comes to complicated socio-technical topics like protocol,"" he writes in the preface.

Galloway begins by examining the types of protocols that exist, including TCP/IP, DNS, and HTML. He then looks at examples of resistance and subversion--hackers, viruses, cyberfeminism, Internet art--which he views as emblematic of the larger transformations now taking place within digital culture. Written for a nontechnical audience, Protocol serves as a necessary counterpoint to the wildly utopian visions of the Net that were so widespread in earlier days.",Computer Science; Computers; History; Internet; Technology & Engineering,en,2021-02-13,,2021-02-14,,,,,,
5C0FC3FA-F304-41F2-AE9E-F7B1F59C74F4,HOs9DwAAQBAJ,,9780691168463,The Coming of the French Revolution,,"Lefebvre, Georges",280,,Princeton University Press,"The Coming of the French Revolution remains essential reading for anyone interested in the origins of this great turning point in the formation of the modern world. First published in 1939, on the eve of the Second World War, and suppressed by the Vichy government, this classic work explains what happened in France in 1789, the first year of the French Revolution. Georges Lefebvre wrote history ""from below""—a Marxist approach. Here, he places the peasantry at the center of his analysis, emphasizing the class struggles in France and the significant role they played in the coming of the revolution.

Eloquently translated by the historian R. R. Palmer and featuring an introduction by Timothy Tackett that provides a concise intellectual biography of Lefebvre and a critical appraisal of the book, this Princeton Classics edition continues to offer fresh insights into democracy, dictatorship, and insurrection.",Europe; France; History; Revolutionary,en,2021-02-14,,2021-02-18,,,,,,
C590B514-58DF-4508-B544-B939B0604BBD,-efB6GTgNdAC,,9780199741069,The Great Wave,Price Revolutions and the Rhythm of History,"Fischer, David Hackett",552,,Oxford University Press,"David Hackett Fischer, one of our most prominent historians, has garnered a reputation for making history come alive--even stories as familiar as Paul Revere's ride, or as complicated as the assimilation of British culture in North America. Now, in The Great Wave, Fischer has done it again, marshaling an astonishing array of historical facts in lucid and compelling prose to outline a history of prices--""the history of change,"" as Fischer puts it--covering the dazzling sweep of Western history from the medieval glory of Chartres to the modern day. Going far beyond the economic data, Fischer writes a powerful history of the people of the Western world: the economic patterns they lived in, and the politics, culture, and society that they created as a result. As he did in Albion's Seed and Paul Revere's Ride, two of the most talked-about history books in recent years, Fischer combines extensive research and meticulous scholarship with wonderfully evocative writing to create a book for scholars and general readers alike. Records of prices are more abundant than any other quantifiable data, and span the entire range of history, from tables of medieval grain prices to the overabundance of modern statistics. Fischer studies this wealth of data, creating a narrative that encompasses all of Western culture. He describes four waves of price revolutions, each beginning in a period of equilibrium: the High Middle Ages, the Renaissance, the Enlightenment, and finally the Victorian Age. Each revolution is marked by continuing inflation, a widening gap between rich and poor, increasing instability, and finally a crisis at the crest of the wave that is characterized by demographic contraction, social and political upheaval, and economic collapse. The most violent of these climaxes was the catastrophic fourteenth century, in which war, famine, and the Black Death devastated the continent--the only time in Europe's history that the population actually declined. Fischer also brilliantly illuminates how these long economic waves are closely intertwined with social and political events, affecting the very mindset of the people caught in them. The long periods of equilibrium are marked by cultural and intellectual movements--such as the Renaissance, the Enlightenment, and the Victorian Age-- based on a belief in order and harmony and in the triumph of progress and reason. By contrast, the years of price revolution created a melancholy culture of despair. Fischer suggests that we are living now in the last stages of a price revolution that has been building since the turn of the century. The destabilizing price surges and declines and the diminished expectations the United States has suffered in recent years--and the famines and wars of other areas of the globe--are typical of the crest of a price revolution. He does not attempt to predict what will happen, noting that ""uncertainty about the future is an inexorable fact of our condition."" Rather, he ends with a brilliant analysis of where we might go from here and what our choices are now. This book is essential reading for anyone concerned about the state of the world today.",Business & Economics; Economic History; History; World,en,2021-02-18,,2021-02-22,,,,,,
804A2052-CD5A-4BC9-8D98-60BC5375BCE2,zv8PAQAAIAAJ,,9780865974135,Christianity and Classical Culture,A Study of Thought and Action from Augustus to Augustine,"Cochrane, Charles Norris",624,,Liberty Fund,"Christianity and Classical Culture is considered one of the great works of scholarship published in the last century. The theme of Christianity and Classical Culture is the fundamental change in thought and action that occurred from the reign of Augustus to the time of Augustine. The classical world sought to practice politics and understand the world in purely rational terms, but the difficulties of this program were already evident as Christianity began developing a completely new understanding of the human world. It is from this revolution in ideas that our modern world was forged.

W. H. Auden wrote of an earlier edition in The New Republic ""Since the appearance of the first edition in 1940, I have read this book many times, and my conviction of its importance to the understanding not only of the epoch with which it is concerned, but also of our own, has increased with each rereading.""

Charles Norris Cochrane (1889-1945) was educated at the University of Toronto and Oxford (Corpus Christi College) and taught at the University of Toronto.",Anthropology; Christianity; Cultural & Social; History; History & Surveys; Modern; Philosophy; Religion; Social Science,en,2021-02-23,,2021-03-28,,,,,,
D583E5B9-084A-4406-85B2-783808CABC83,YI19jgEACAAJ,,9780804170147,Wind / Pinball,Two Early Novels,"Murakami, Haruki",233,,Alfred A. Knopf,"NATIONAL BESTSELLER

Wind/Pinball, a unique two-in-one volume, includes, on one side, Murakami's first novel Hear the Wind Sing. When you flip the book over, you can read his second novel, Pinball, 1973. Each book has its own stunning cover.

In the spring of 1978, a young Haruki Murakami sat down at his kitchen table and began to write. The result: two remarkable short novels--Hear the Wind Sing and Pinball, 1973--that launched the career of one of the most acclaimed authors of our time.

These powerful, at times surreal, works about two young men coming of age--the unnamed narrator and his friend the Rat--are stories of loneliness, obsession, and eroticism. They bear all the hallmarks of Murakami's later books, and form the first two-thirds, with A Wild Sheep Chase, of the trilogy of the Rat.

Widely available in English for the first time ever, newly translated, and featuring a new introduction by Murakami himself, Wind/Pinball gives us a fascinating insight into a great writer's beginnings.",,en,2021-03-28,,2021-03-31,,,,,,
646D0FE3-A2DB-4234-BB23-AC2F3D111546,YeycDwAAQBAJ,,9780812982114,Rise and Kill First,The Secret History of Israel's Targeted Assassinations,"Bergman, Ronen",784,,Random House Publishing Group,"NEW YORK TIMES BESTSELLER * The first definitive history of the Mossad, Shin Bet, and the IDF's targeted killing programs, hailed by The New York Times as ""an exceptional work, a humane book about an incendiary subject.""

WINNER OF THE NATIONAL JEWISH BOOK AWARD IN HISTORY

NAMED ONE OF THE TEN BEST BOOKS OF THE YEAR BY JENNIFER SZALAI, THE NEW YORK TIMES 
NAMED ONE OF THE BEST BOOKS OF THE YEAR BY The Economist * The New York Times Book Review * BBC History Magazine * Mother Jones * Kirkus Reviews

The Talmud says: ""If someone comes to kill you, rise up and kill him first."" This instinct to take every measure, even the most aggressive, to defend the Jewish people is hardwired into Israel's DNA. From the very beginning of its statehood in 1948, protecting the nation from harm has been the responsibility of its intelligence community and armed services, and there is one weapon in their vast arsenal that they have relied upon to thwart the most serious threats: Targeted assassinations have been used countless times, on enemies large and small, sometimes in response to attacks against the Israeli people and sometimes preemptively.

In this page-turning, eye-opening book, journalist and military analyst Ronen Bergman--praised by David Remnick as ""arguably [Israel's] best investigative reporter""--offers a riveting inside account of the targeted killing programs: their successes, their failures, and the moral and political price exacted on the men and women who approved and carried out the missions.

Bergman has gained the exceedingly rare cooperation of many current and former members of the Israeli government, including Prime Ministers Shimon Peres, Ehud Barak, Ariel Sharon, and Benjamin Netanyahu, as well as high-level figures in the country's military and intelligence services: the IDF (Israel Defense Forces), the Mossad (the world's most feared intelligence agency), Caesarea (a ""Mossad within the Mossad"" that carries out attacks on the highest-value targets), and the Shin Bet (an internal security service that implemented the largest targeted assassination campaign ever, in order to stop what had once appeared to be unstoppable: suicide terrorism).

Including never-before-reported, behind-the-curtain accounts of key operations, and based on hundreds of on-the-record interviews and thousands of files to which Bergman has gotten exclusive access over his decades of reporting, Rise and Kill First brings us deep into the heart of Israel's most secret activities. Bergman traces, from statehood to the present, the gripping events and thorny ethical questions underlying Israel's targeted killing campaign, which has shaped the Israeli nation, the Middle East, and the entire world.

""A remarkable feat of fearless and responsible reporting . . . important, timely, and informative.""--John le Carré",History; Israel & Palestine; Middle East; Military; Political Science; Security (National & International); Strategy,en,2021-04-01,,2021-05-01,,,,,,
